File,Timestamp,PageNumber,HighlightedText,UserNote
"file:///media/Books/Colorless Tsukuru Tazaki and His Years of Pilgrimage A novel by Murakami Haruki (z-lib.org).epub","8/21/2020 00:03",65,"You need to use the thread of logic, as best you can, to skillfully sew onto yourself everything that’s worth living for",
"file:///media/Books/Colorless Tsukuru Tazaki and His Years of Pilgrimage A novel by Murakami Haruki (z-lib.org).epub","8/22/2020 01:47",82,"There must be something in him, something fundamental, that disenchanted people. “Colorless Tsukuru Tazaki,” he said aloud. I basically have nothing to offer to others. If you think about it, I don’t even have anything to offer myself.",
"file:///media/Books/Colorless Tsukuru Tazaki and His Years of Pilgrimage A novel by Murakami Haruki (z-lib.org).epub","8/25/2020 01:03",109,"You didn’t say much, but you had your feet solidly planted on the ground, and that gave the group a sense of security. Like an anchor.",
"file:///media/Books/Colorless Tsukuru Tazaki and His Years of Pilgrimage A novel by Murakami Haruki (z-lib.org).epub","8/25/2020 23:49",118,"Outsourcing employee education.”",
"file:///media/Books/Colorless Tsukuru Tazaki and His Years of Pilgrimage A novel by Murakami Haruki (z-lib.org).epub","8/25/2020 23:57",122,"You can hide memories, but you can’t erase the history that produced them.",
"file:///media/Books/Colorless Tsukuru Tazaki and His Years of Pilgrimage A novel by Murakami Haruki (z-lib.org).epub","8/26/2020 00:00",124,"placid ",
"file:///media/Books/Colorless Tsukuru Tazaki and His Years of Pilgrimage A novel by Murakami Haruki (z-lib.org).epub","8/27/2020 00:07",145," joy of really wanting something and struggling to get ",
"file:///media/Books/Colorless Tsukuru Tazaki and His Years of Pilgrimage A novel by Murakami Haruki (z-lib.org).epub","8/27/2020 23:56",148,"“May the force be with you,” she said. “So you don’t lose out to the salmon.”",
"file:///media/Books/Colorless Tsukuru Tazaki and His Years of Pilgrimage A novel by Murakami Haruki (z-lib.org).epub","8/28/2020 00:05",154,"He wore his usual outfit—chinos, black polo shirt, sneakers, and a light brown cotton jacket",
"file:///media/Books/Colorless Tsukuru Tazaki and His Years of Pilgrimage A novel by Murakami Haruki (z-lib.org).epub","8/28/2020 00:17",161,"Some things in life are too complicated to explain in any language.",
"file:///media/Books/Colorless Tsukuru Tazaki and His Years of Pilgrimage A novel by Murakami Haruki (z-lib.org).epub","8/29/2020 02:07",179,"Maybe it’s part of my personality, something I was born with. Maybe I’ve always had an instinctive tendency to leave a buffer zone between me and others",
"file:///media/Books/Colorless Tsukuru Tazaki and His Years of Pilgrimage A novel by Murakami Haruki (z-lib.org).epub","8/31/2020 00:06",191,"“Everyone alive has a personality. It’s just more obvious with some people than with others.” ",
"file:///media/Books/Colorless Tsukuru Tazaki and His Years of Pilgrimage A novel by Murakami Haruki (z-lib.org).epub","8/31/2020 00:14",196,"no brilliant color. I have nothing to offer. That’s always been my problem. I feel like an empty vessel. I have a shape, I guess, as a container, but there’s nothing inside. I just can’t see myself as the right person for her. I think that the more time passes, and the more she knows about me, the more disappointed Sara will be, and the more she’ll choose to distance herself from me.",
"file:///media/Books/Colorless Tsukuru Tazaki and His Years of Pilgrimage A novel by Murakami Haruki (z-lib.org).epub","8/31/2020 00:46",214,"Tsukuru Tazaki had nowhere he had to go. This was like a running theme of his life. He had no place he had to go to, no place to come back to. He never did, and he didn’t now. The only place for him was where he was now.",
"file:///media/Books/Colorless Tsukuru Tazaki and His Years of Pilgrimage A novel by Murakami Haruki (z-lib.org).epub","8/31/2020 00:48",215,"He had no one he could call a close friend",
"file:///sdcard/My Files/Webpages/Making Better Games Through Iteration (2020.09.03-06.40.55Z).epub","9/4/2020 18:33",2," iterative developmental process",
"file:///sdcard/My Files/Books/Ikigai The Japanese Secret to a Long and Happy Life by Héctor García, Francesc Miralles (z-lib.org).epub","9/11/2020 00:58",44,"Csikszentmihalyi called this state “flow,” and described it as the pleasure, delight, creativity, and process when we are completely immersed in life.",
"file:///sdcard/My Files/Books/Ikigai The Japanese Secret to a Long and Happy Life by Héctor García, Francesc Miralles (z-lib.org).epub","9/11/2020 01:04",49,"a happy man is too satisfied with the present to dwell on the future.”",
"file:///sdcard/My Files/Books/Ikigai The Japanese Secret to a Long and Happy Life by Héctor García, Francesc Miralles (z-lib.org).epub","9/13/2020 01:35",105,"Fall seven times, rise eight.",
"file:///sdcard/My Files/Books/Ikigai The Japanese Secret to a Long and Happy Life by Héctor García, Francesc Miralles (z-lib.org).epub","9/13/2020 01:41",109,"Japanese culture accepts the fleeting nature of the human being and everything we create.",
"file:///media/Books/Colorless Tsukuru Tazaki and His Years of Pilgrimage A novel by Murakami Haruki (z-lib.org).epub","9/15/2020 01:07",32,"You can hide memories, but you can’t erase the history that produced them",
"file:///media/Books/Fluent Japanese from Anime and Manga How to Learn Japanese Vocabulary, Grammar, and Kanji the Easy and Fun Way by Eric Bodnar (z-lib.org).epub","9/17/2020 00:30",16,"When you have no way of judging whether or not you are improving at a skill, quitting is inevitable.",
"file:///media/Books/Fluent Japanese from Anime and Manga How to Learn Japanese Vocabulary, Grammar, and Kanji the Easy and Fun Way by Eric Bodnar (z-lib.org).epub","9/19/2020 08:34",27,"Boredom is our brain's way of telling us that we are going to burn out if we continue to push ourselves to learn from the same material day after day",
"calibre:5 uuid:dcf8c984-0abf-4110-89c9-1088c1a8de7b 9780134835211","10/10/2020 08:43",102,"normalized() #",
"calibre:5 uuid:dcf8c984-0abf-4110-89c9-1088c1a8de7b 9780134835211","10/10/2020 08:45",104,"Emulate Touchscreen a",
"calibre:5 uuid:dcf8c984-0abf-4110-89c9-1088c1a8de7b 9780134835211","10/10/2020 08:48",100,"Subclasses of InputEvent Class",
"file:///media/Books/Fluent Japanese from Anime and Manga How to Learn Japanese Vocabulary, Grammar, and Kanji the Easy and Fun Way by Eric Bodnar (z-lib.org).epub","11/9/2020 00:58",41,"For every major grammar point or topic covered, grab three, four, or five sentences and make one Listening card for each. You can use Cloze cards as well to test for kanji, vocabulary, and correct grammar usage if you think there is enough context to make the answer clear and unambiguous.",
"file:///media/My Files/Books/Men Without Women Stories by Haruki Murakami (z-lib.org).epub","12/19/2020 01:25",21,"Our actions aren’t based on specifics like that—we can’t pinpoint why we do what we do.",
"file:///media/My Files/Books/Men Without Women Stories by Haruki Murakami (z-lib.org).epub","12/19/2020 09:16",30,"Uncle Vanya ",
"file:///media/My Files/Books/Men Without Women Stories by Haruki Murakami (z-lib.org).epub","12/19/2020 09:31",86,"The scene seemed somehow divorced from reality",
"file:///media/My Files/Books/Men Without Women Stories by Haruki Murakami (z-lib.org).epub","12/19/2020 09:41",91,"the most mundane objects became somehow radiant by being his",
"file:///media/My Files/Books/Men Without Women Stories by Haruki Murakami (z-lib.org).epub","12/21/2020 01:11",108,"Like dry ground welcoming the rain, he let the solitude, silence, and loneliness soak in",
"file:///media/My Files/Books/Men Without Women Stories by Haruki Murakami (z-lib.org).epub","12/21/2020 01:34",123,"But there are times in this world when it’s not enough just not to do the wrong thing. Some people use that blank space as a kind of loophole. Do you understand what I’m saying?”",
"file:///media/My Files/Books/Men Without Women Stories by Haruki Murakami (z-lib.org).epub","12/21/2020 01:38",125,"The window next to his bed was streaked with water drops, a ceaseless cycle of new drops replacing the old. ",
"file:///media/My Files/Books/Men Without Women Stories by Haruki Murakami (z-lib.org).epub","12/28/2020 01:44",35,"Because, in the final analysis, the language we speak constitutes who we are as people.",
"file:///media/My Files/Books/Men Without Women Stories by Haruki Murakami (z-lib.org).epub","12/30/2020 01:05",56,"For no one knows what kind of dreams tomorrow will bring.",
"file:///media/My Files/Books/Men Without Women Stories by Haruki Murakami (z-lib.org).epub","1/1/2021 01:36",160,"“A Summer Place.”",
"file:///media/My Files/Books/Men Without Women Stories by Haruki Murakami (z-lib.org).epub","1/1/2021 01:41",157,"It’s quite easy to become Men Without Women. You love a woman deeply, and then she goes off somewhere. That’s all it takes. ",
"file:///sdcard/My Files/Books/Textbooks for school/Language Files Materials for an Introduction to Language and Linguistics by Department of Linguistics (z-lib.org).epub","1/6/2021 23:24",36," one could think of speech as an immediately physically transmittable form, while writing is a physically preservable form.",
"file:///sdcard/My Files/Books/Textbooks for school/Language Files Materials for an Introduction to Language and Linguistics by Department of Linguistics (z-lib.org).epub","1/6/2021 23:26",37,"Writing must be taught, whereas spoken language is acquired naturall",
"file:///sdcard/My Files/Books/Textbooks for school/Language Files Materials for an Introduction to Language and Linguistics by Department of Linguistics (z-lib.org).epub","1/6/2021 23:38",41,"Descriptive grammars allow for different varieties of a language; ","its like following language as it evolves."
"file:///sdcard/My Files/Books/Textbooks for school/Language Files Materials for an Introduction to Language and Linguistics by Department of Linguistics (z-lib.org).epub","1/6/2021 23:43",42,"these rules were formulated by people on the basis of something other than the actual language being spoken around them. ",
"file:///sdcard/My Files/Books/Textbooks for school/Language Files Materials for an Introduction to Language and Linguistics by Department of Linguistics (z-lib.org).epub","1/6/2021 23:46",44,"prescriptive rules allows a speaker of a nonstandard dialect to explicitly learn the rules of the standard dialect and employ them in appropriate social circumstances",keigo
"file:///sdcard/My Files/Books/Textbooks for school/Language Files Materials for an Introduction to Language and Linguistics by Department of Linguistics (z-lib.org).epub","1/7/2021 14:39",47,"children will learn the language(s) or dialect(s) that other people use to interact with them.",
"file:///sdcard/My Files/Books/Textbooks for school/Language Files Materials for an Introduction to Language and Linguistics by Department of Linguistics (z-lib.org).epub","1/7/2021 14:42",47,"The term arbitrary here refers to the fact that the meaning is not in any way predictable from the form, nor is the form dictated by the meaning. ",
"file:///sdcard/My Files/Books/Textbooks for school/Language Files Materials for an Introduction to Language and Linguistics by Department of Linguistics (z-lib.org).epub","1/7/2021 15:07",52,"does this mean that any communication system that exhibits all nine features should be considered a language?",
"file:///sdcard/My Files/Books/Textbooks for school/Language Files Materials for an Introduction to Language and Linguistics by Department of Linguistics (z-lib.org).epub","1/10/2021 23:35",70,"<th> sounds in thy and thigh",
"file:///sdcard/My Files/Books/Textbooks for school/Language Files Materials for an Introduction to Language and Linguistics by Department of Linguistics (z-lib.org).epub","1/10/2021 23:36",71,"The influence of one sound on a neighboring sound is known as co-articulation",
"file:///sdcard/My Files/Books/Textbooks for school/Language Files Materials for an Introduction to Language and Linguistics by Department of Linguistics (z-lib.org).epub","1/12/2021 23:54",77,"Sounds made with the vocal folds vibrating are called voiced sounds, and sounds made without such vibration are called voiceless sounds.",
"file:///media/My Files/Books/The Life-Changing Magic of Tidying Up The Japanese Art of Decluttering and Organizing by Marie Kondo (z-lib.org).epub","1/13/2021 23:41",21,"Putting things away creates the illusion that the clutter problem has been solved",
"file:///media/My Files/Books/Men Without Women Stories by Haruki Murakami (z-lib.org).epub","1/14/2021 23:32",28," If we hope to truly see another person, we have to start by looking within ourselves.”",
"file:///media/My Files/Books/Men Without Women Stories by Haruki Murakami (z-lib.org).epub","1/14/2021 23:54",19,"No, I had lots of pals back then. But once I grew up I no longer felt the need for them. Especially after I got married.”",
"file:///media/My Files/Books/Make It Stick The Science of Successful Learning by Peter C. Brown, Henry L. Roediger III, Mark A. McDaniel (z-lib.org).epub","9/26/2021 10:19",48,"critical sorting process",
"file:///media/My Files/Books/How to Talk to Girls Simplified 3 Steps How to Have Her at Hello and Attract Women Through Honesty by German Muhlenberg (z-lib.org) (1).epub","11/1/2021 22:49",32,"The issue is that it’s important to know how to direct conversations so that they’re exciting.",
"file:///media/My Files/Books/How to Talk to Girls Simplified 3 Steps How to Have Her at Hello and Attract Women Through Honesty by German Muhlenberg (z-lib.org) (1).epub","11/1/2021 22:51",33,"Statements also oblige us to share our thoughts with a woman and share who we are, thus showing vulnerability.",
"file:///media/My Files/Books/How to Talk to Girls Simplified 3 Steps How to Have Her at Hello and Attract Women Through Honesty by German Muhlenberg (z-lib.org) (1).epub","11/1/2021 23:10",34,"Why does she want the things she wants?",
"file:///media/My Files/Books/How to Talk to Girls Simplified 3 Steps How to Have Her at Hello and Attract Women Through Honesty by German Muhlenberg (z-lib.org) (1).epub","11/2/2021 08:33",31,"great conversations are pretty chaotic",
"file:///media/My Files/Books/How to Talk to Girls Simplified 3 Steps How to Have Her at Hello and Attract Women Through Honesty by German Muhlenberg (z-lib.org) (1).epub","11/2/2021 09:03",30,"that ","j
"
"file:///media/My Files/Books/How to Talk to Girls Simplified 3 Steps How to Have Her at Hello and Attract Women Through Honesty by German Muhlenberg (z-lib.org) (1).epub","11/2/2021 09:03",30,"that ","j
"
"file:///media/My Files/Books/How to Talk to Girls Simplified 3 Steps How to Have Her at Hello and Attract Women Through Honesty by German Muhlenberg (z-lib.org) (1).epub","11/2/2021 09:07",30,"If you do not generate fun, tension and conflict there is no emotion, there is no chemistry.","throw zest into conversation by not asking the same old boring factual interview like questions over and over. zest being humor, emotion, even conflict."
"file:///media/My Files/Books/How to Talk to Girls Simplified 3 Steps How to Have Her at Hello and Attract Women Through Honesty by German Muhlenberg (z-lib.org) (1).epub","11/2/2021 09:15",32,"say something about yourself like","""ive always wanted to live in japan""
""when i got addicted to anime it felt like an escape actually""
""i feel like cooking japanese food is hard but i want to learn."""
"file:///media/My Files/Books/How to Talk to Girls Simplified 3 Steps How to Have Her at Hello and Attract Women Through Honesty by German Muhlenberg (z-lib.org) (1).epub","11/2/2021 09:17",33,"based on some particular trait. Instead of asking what we want to know, we simply try to predict it.",
"file:///media/My Files/Books/How to Talk to Girls Simplified 3 Steps How to Have Her at Hello and Attract Women Through Honesty by German Muhlenberg (z-lib.org) (1).epub","11/2/2021 09:19",34,"My name is Jimmy, I'm 24 years old and I like to travel
 .","hi im jimmy and i love the sense of adventure when i travel."
"file:///media/My Files/Books/How to Talk to Girls Simplified 3 Steps How to Have Her at Hello and Attract Women Through Honesty by German Muhlenberg (z-lib.org) (1).epub","11/2/2021 09:20",34,"These are the things that make us unique, that is, different from the last 30 dudes who spoke with her",
"file:///media/My Files/Books/How to Talk to Anyone 92 Little Tricks for Big Success in Relationships by Leil Lowndes (z-lib.org).epub","11/3/2021 07:48",17,"Sticky Eyes",
"file:///media/My Files/Books/How to Talk to Anyone 92 Little Tricks for Big Success in Relationships by Leil Lowndes (z-lib.org).epub","11/3/2021 07:54",40,"match your listeners 
        mood, if only for a sentence or two. When it comes to small talk, think music, not words",
"file:///media/My Files/Books/How to Talk to Anyone 92 Little Tricks for Big Success in Relationships by Leil Lowndes (z-lib.org).epub","11/3/2021 07:57",42,"He made unoriginal remarks to set them at ease. ",
"file:///media/My Files/Books/How to Talk to Girls Simplified 3 Steps How to Have Her at Hello and Attract Women Through Honesty by German Muhlenberg (z-lib.org) (1).epub","11/3/2021 09:07",45,"As soon as they see an attractive woman, they worry too much about how to pick her up and not about their own fun, sabotaging themselves",
"file:///media/My Files/Books/How to Talk to Girls Simplified 3 Steps How to Have Her at Hello and Attract Women Through Honesty by German Muhlenberg (z-lib.org) (1).epub","11/3/2021 09:08",46,"do not deprive yourself of doing something you like for fear that she will reject you for it.",
"file:///media/My Files/Books/How to Talk to Girls Simplified 3 Steps How to Have Her at Hello and Attract Women Through Honesty by German Muhlenberg (z-lib.org) (1).epub","11/3/2021 09:10",46,"Treat her how you would treat your younger sister, act playful and annoying",
"file:///media/My Files/Books/How to Talk to Girls Simplified 3 Steps How to Have Her at Hello and Attract Women Through Honesty by German Muhlenberg (z-lib.org) (1).epub","11/3/2021 09:11",47,"you can repeat what she said and exaggerate her voice or accent in a funny way",
"file:///media/My Files/Books/How to Talk to Girls Simplified 3 Steps How to Have Her at Hello and Attract Women Through Honesty by German Muhlenberg (z-lib.org) (1).epub","11/3/2021 09:12",47," If she says “let's do it” (in any context), you can say,
 “I think you're going too fast”
 .",
"file:///media/My Files/Books/How to Talk to Girls Simplified 3 Steps How to Have Her at Hello and Attract Women Through Honesty by German Muhlenberg (z-lib.org) (1).epub","11/3/2021 09:22",48,"Are you like this with everyone?",
"file:///media/My Files/Books/How to Talk to Girls Simplified 3 Steps How to Have Her at Hello and Attract Women Through Honesty by German Muhlenberg (z-lib.org) (1).epub","11/3/2021 16:46",50,"don’t be afraid of not talking to her for one or several days",
"file:///media/My Files/Books/How to Talk to Anyone 92 Little Tricks for Big Success in Relationships by Leil Lowndes (z-lib.org).epub","11/7/2021 07:37",51,"Whenever people ask you what you do, give them 
        some mouth-to-ear resuscitation so they can catch their breath and say something",
"file:///media/My Files/Books/How to Talk to Anyone 92 Little Tricks for Big Success in Relationships by Leil Lowndes (z-lib.org).epub","11/7/2021 07:37",52,"Padding the introduction",
"file:///media/My Files/Books/How to Talk to Anyone 92 Little Tricks for Big Success in Relationships by Leil Lowndes (z-lib.org).epub","11/7/2021 07:38",54,"Top communicators know ideas dont come out of nowhere. If Mrs. Otis thought to bring up 
        plants, then she must have some relationship with them.",
"file:///media/My Files/Books/How to Talk to Anyone 92 Little Tricks for Big Success in Relationships by Leil Lowndes (z-lib.org).epub","11/7/2021 07:54",63,"But at least be prepared in case inspiration doesnt hit.
      The best way to ensure youre conversationally in the swing of things is to listen to a 
        newscast just before you leave.",
"file:///media/My Files/Books/How to Talk to Girls Simplified 3 Steps How to Have Her at Hello and Attract Women Through Honesty by German Muhlenberg (z-lib.org) (1).epub","11/9/2021 06:45",36,"Just giving her small touches on the arm is usually enough",
"file:///media/My Files/Books/How to Talk to Girls Simplified 3 Steps How to Have Her at Hello and Attract Women Through Honesty by German Muhlenberg (z-lib.org) (1).epub","11/9/2021 06:47",37," If you find yourself in this situation, what I recommend most is to confess to her that you like her.",
"file:///media/My Files/Books/How to Talk to Girls Simplified 3 Steps How to Have Her at Hello and Attract Women Through Honesty by German Muhlenberg (z-lib.org) (1).epub","11/9/2021 06:56",24,"men prioritize women, thus losing their own identity, their own purpose and life",
"file:///media/My Files/Books/How to Talk to Girls Simplified 3 Steps How to Have Her at Hello and Attract Women Through Honesty by German Muhlenberg (z-lib.org) (1).epub","11/9/2021 06:57",24,"A lack of self-confidence and a lack of a clear purpose in life are the main shortcomings of an emotionally helpless person, who will tend to prioritize other people over themselves",
"file:///media/My Files/Books/How to Talk to Girls Simplified 3 Steps How to Have Her at Hello and Attract Women Through Honesty by German Muhlenberg (z-lib.org) (1).epub","11/9/2021 07:00",25,"Let's face it, if we're nervous, it's okay.",
"file:///media/My Files/Books/How to Talk to Girls Simplified 3 Steps How to Have Her at Hello and Attract Women Through Honesty by German Muhlenberg (z-lib.org) (1).epub","11/9/2021 07:11",26,"most people don’t remember what the first words were but the presence, look, emotional need and so on. This is another reason why we shouldn’t worry so much about “what” to say.",
"file:///media/My Files/Books/How to Talk to Girls Simplified 3 Steps How to Have Her at Hello and Attract Women Through Honesty by German Muhlenberg (z-lib.org) (1).epub","11/9/2021 07:19",27," presenting yourself in an honest, open way in most cases has a positive or neutral reception",
"file:///media/My Files/Books/How to Talk to Girls Simplified 3 Steps How to Have Her at Hello and Attract Women Through Honesty by German Muhlenberg (z-lib.org) (1).epub","11/9/2021 07:27",29,"Suddenly, she went from being a goddess to a human being... to a woman.",
"file:///media/My Files/Books/Men Without Women Stories by Haruki Murakami (z-lib.org).epub","11/9/2021 09:08",14," He liked her smooth and assured driving, her lack of chatter, and the way she kept her feelings to herself.",
"file:///media/My Files/Books/Men Without Women Stories by Haruki Murakami (z-lib.org).epub","11/10/2021 08:45",16,"He was lost in those thoughts at the crematorium as he plucked her bones from the ashes. ",
"file:///media/My Files/Books/Men Without Women Stories by Haruki Murakami (z-lib.org).epub","11/10/2021 08:46",16,"Yet he continued to return to his core principle: that, in every situation, knowledge was better than ignorance.",
"file:///media/My Files/Books/Men Without Women Stories by Haruki Murakami (z-lib.org).epub","11/10/2021 08:52",18,"Did you ever not want to go back?”",
"file:///media/My Files/Books/Men Without Women Stories by Haruki Murakami (z-lib.org).epub","11/10/2021 08:55",18,"Performing allowed me to be someone other than myself. And I could revert back when the performance ended. ",
"file:///media/My Files/Books/Men Without Women Stories by Haruki Murakami (z-lib.org).epub","11/10/2021 12:13",27,"But, Mr. Kafuku, can any of us ever perfectly understand another person? However much we may lov",
"file:///media/My Files/Books/Men Without Women Stories by Haruki Murakami (z-lib.org).epub","11/10/2021 12:15",28,"But the proposition that we can look into another person’s heart with perfect clarity strikes me as a fool’s game. ",
"file:///media/My Files/Books/Seduction Simplified Full version How to Create Powerful Self Confidence Habits to Change Your Life with women by German Muhlenberg (z-lib.org).epub","11/12/2021 06:59",18,"If you think you are not worth a dime, that’s what you are going to project onto others. ",
"file:///media/My Files/Books/Seduction Simplified Full version How to Create Powerful Self Confidence Habits to Change Your Life with women by German Muhlenberg (z-lib.org).epub","11/12/2021 07:04",25,"The main problem of defining our identity through material possessions is that it implies that what we are looking for is external validation. ",
"file:///media/My Files/Books/Seduction Simplified Full version How to Create Powerful Self Confidence Habits to Change Your Life with women by German Muhlenberg (z-lib.org).epub","11/12/2021 07:06",25,"loss aversion. This is a psychological concept stating that the grief we derive from losing",
"file:///media/My Files/Books/Seduction Simplified Full version How to Create Powerful Self Confidence Habits to Change Your Life with women by German Muhlenberg (z-lib.org).epub","11/12/2021 07:07",25,"What we stand for― our values, our behavior, our passions, our relationships, our beliefs, our actions― is the sum total of everything we do",
"file:///media/My Files/Books/Seduction Simplified Full version How to Create Powerful Self Confidence Habits to Change Your Life with women by German Muhlenberg (z-lib.org).epub","11/12/2021 07:11",26,"we should rebel against mediocrity, and do our best, be the best version of ourselves",
